{"algorithm":"typaxis.machine-figure-manifest/1","body":{"height":70,"width":80,"x":10,"y":10},"contract":"typaxis.contract/1.2","display_sha256":"94393e5db8e3952ed5005a87442611164e71655b5778f4c647141f23e44f7d9c","figure_usage_sha256":"6ecba4abb44206fbcd2285f7d7bfddd71a23a67acb7ce8d18840de9718f79cd0","figures":[{"admitted_byte_length":99,"admitted_sha256":"d258ded2ba32f918e46abed09cf3e9f14d274355a65c92fd0a948a4340e24d74","alt":"opaque-extension PNG","attested_media_kind":"png","caption_flow_id":1,"caption_fragments":[{"caption_flow_id":1,"caption_node_id":2,"page_index":1,"rect":{"height":15,"width":80,"x":10,"y":10}},{"caption_flow_id":1,"caption_node_id":3,"page_index":1,"rect":{"height":15,"width":80,"x":10,"y":25}}],"decoded_bytes":8,"document_ordinal":0,"draw_image_count":1,"effective_space_before":0,"figure_flow_id":0,"figure_node_id":1,"image_id":0,"keep_policy":"allow_caption_split","moved_to_fresh_page":false,"oversize_policy":"terminal_once","page_index":0,"pixel_height":1,"pixel_width":2,"rect":{"height":20,"width":40,"x":15,"y":60}}],"flow_registry_sha256":"a458c34329a57011e2e170907de11df1c92f5468fbbfa78e3a937226283eab48","image_xobject_count":2,"image_xobjects":[{"image_id":0,"resource_name":"/Im0"}],"layout_epoch":{"admitted_resources_sha256":"f24d17dd2120c1e4114d9ec224bccdb7a7938cd744e0d53eb35a0a7ee2e0c200","document_sha256":"ee70ffd5b5fe213770598fad83c93a69f95151f8e3b1b60964fa71543ec3bdd7","resolved_input_sha256":"6906122af2bf484a8a7306f84ec7e755ed70956ea563fa7c0a9b181c7f657b9f","style_page_master_sha256":"0d34bdf61868df1277faa7d66de8668cdd9773e4f17ce9a095a870c3339223e9"},"layout_state_sha256":"1b33503ef13b81f4a504be3f507d20b67670d2a2e806e8917a7bb6f5edb88099","master_id":"default","object_count":8,"package_sha256":"e9e58ac1e16de5ecbc246971e6afc16bd6a795949b258d067bb8e716cbd6832a","page_count":2,"page_height":100,"page_width":100,"pages":[{"caption_block_count":0,"figure_count":1,"page_index":0},{"caption_block_count":2,"figure_count":0,"page_index":1}],"pdf_byte_length":1253,"pdf_sha256":"92974b7603a554ba9ac6c491ca12728b36bb254520b9bc8fc1dea058db3a8e1c","policy_version":"typaxis.basic-png-figure-policy/1","profile":"typaxis.machine-pdf/basic-document-1","selected_state_sha256":"1b33503ef13b81f4a504be3f507d20b67670d2a2e806e8917a7bb6f5edb88099"}
